loteId,notificacionId,resultado,fechaResultado,observacion
LOTE-CORREO-20260602-235653-001,NOT-0004-01,POSITIVA,2026-06-02T23:56:53.9873576,Respuesta demo POSITIVA para ACTA_INFRACCION
LOTE-CORREO-20260602-235653-001,NOT-0037-01,NEGATIVA,2026-06-02T23:57:53.9873576,Respuesta demo NEGATIVA para FALLO_CONDENATORIO
LOTE-CORREO-20260602-235653-001,NOT-0038-01,VENCIDA,2026-06-02T23:58:53.9873576,Respuesta demo VENCIDA para ACTA_INFRACCION
LOTE-CORREO-20260602-235653-001,NOT-0039-01,POSITIVA,2026-06-02T23:59:53.9873576,Respuesta demo POSITIVA para FALLO_CONDENATORIO
LOTE-CORREO-20260602-235653-001,NOT-0040-01,NEGATIVA,2026-06-03T00:00:53.9873576,Respuesta demo NEGATIVA para FALLO_ABSOLUTORIO
