loteId,notificacionId,resultado,fechaResultado,observacion
LOTE-CORREO-20260602-235654-001,NOT-0004-01,POSITIVA,2026-06-02T23:56:54.622671,Respuesta demo POSITIVA para ACTA_INFRACCION
LOTE-CORREO-20260602-235654-001,NOT-0030-03,NEGATIVA,2026-06-02T23:57:54.622671,Respuesta demo NEGATIVA para FALLO_CONDENATORIO
LOTE-CORREO-20260602-235654-001,NOT-0037-01,VENCIDA,2026-06-02T23:58:54.622671,Respuesta demo VENCIDA para FALLO_CONDENATORIO
LOTE-CORREO-20260602-235654-001,NOT-0038-01,POSITIVA,2026-06-02T23:59:54.622671,Respuesta demo POSITIVA para ACTA_INFRACCION
LOTE-CORREO-20260602-235654-001,NOT-0039-01,NEGATIVA,2026-06-03T00:00:54.622671,Respuesta demo NEGATIVA para FALLO_CONDENATORIO
LOTE-CORREO-20260602-235654-001,NOT-0040-01,VENCIDA,2026-06-03T00:01:54.622671,Respuesta demo VENCIDA para FALLO_ABSOLUTORIO
