loteId,notificacionId,resultado,fechaResultado,observacion
LOTE-CORREO-20260608-233617-001,NOT-0004-01,POSITIVA,2026-06-08T23:36:17.7414889,Respuesta demo POSITIVA para ACTA_INFRACCION
LOTE-CORREO-20260608-233617-001,NOT-0030-03,NEGATIVA,2026-06-08T23:37:17.7414889,Respuesta demo NEGATIVA para FALLO_CONDENATORIO
LOTE-CORREO-20260608-233617-001,NOT-0037-01,VENCIDA,2026-06-08T23:38:17.7414889,Respuesta demo VENCIDA para FALLO_CONDENATORIO
LOTE-CORREO-20260608-233617-001,NOT-0038-01,POSITIVA,2026-06-08T23:39:17.7414889,Respuesta demo POSITIVA para ACTA_INFRACCION
LOTE-CORREO-20260608-233617-001,NOT-0039-01,NEGATIVA,2026-06-08T23:40:17.7414889,Respuesta demo NEGATIVA para FALLO_CONDENATORIO
LOTE-CORREO-20260608-233617-001,NOT-0040-01,VENCIDA,2026-06-08T23:41:17.7414889,Respuesta demo VENCIDA para FALLO_ABSOLUTORIO
