loteId,notificacionId,resultado,fechaResultado,observacion
LOTE-CORREO-20260601-112731-001,NOT-0004-01,POSITIVA,2026-06-01T11:27:39.2347808,Respuesta demo POSITIVA para ACTA_INFRACCION
LOTE-CORREO-20260601-112731-001,NOT-0037-01,NEGATIVA,2026-06-01T11:28:39.2347808,Respuesta demo NEGATIVA para FALLO_CONDENATORIO
LOTE-CORREO-20260601-112731-001,NOT-0038-01,VENCIDA,2026-06-01T11:29:39.2347808,Respuesta demo VENCIDA para ACTA_INFRACCION
LOTE-CORREO-20260601-112731-001,NOT-0039-01,POSITIVA,2026-06-01T11:30:39.2347808,Respuesta demo POSITIVA para FALLO_CONDENATORIO
LOTE-CORREO-20260601-112731-001,NOT-0040-01,NEGATIVA,2026-06-01T11:31:39.2347808,Respuesta demo NEGATIVA para FALLO_ABSOLUTORIO
