loteId,notificacionId,resultado,fechaResultado,observacion
LOTE-CORREO-20260602-231649-001,NOT-0004-01,POSITIVA,2026-06-02T23:16:49.8760093,Respuesta demo POSITIVA para ACTA_INFRACCION
LOTE-CORREO-20260602-231649-001,NOT-0030-03,NEGATIVA,2026-06-02T23:17:49.8760093,Respuesta demo NEGATIVA para FALLO_CONDENATORIO
LOTE-CORREO-20260602-231649-001,NOT-0037-01,VENCIDA,2026-06-02T23:18:49.8760093,Respuesta demo VENCIDA para FALLO_CONDENATORIO
LOTE-CORREO-20260602-231649-001,NOT-0038-01,POSITIVA,2026-06-02T23:19:49.8760093,Respuesta demo POSITIVA para ACTA_INFRACCION
LOTE-CORREO-20260602-231649-001,NOT-0039-01,NEGATIVA,2026-06-02T23:20:49.8760093,Respuesta demo NEGATIVA para FALLO_CONDENATORIO
LOTE-CORREO-20260602-231649-001,NOT-0040-01,VENCIDA,2026-06-02T23:21:49.8760093,Respuesta demo VENCIDA para FALLO_ABSOLUTORIO
